{
  "protocol_version": "2",
  "status": "succeeded",
  "artifacts": [
    {
      "role": "problem_statement",
      "path": "artifacts/problem-statement.md",
      "media_type": "text/markdown"
    },
    {
      "role": "template",
      "path": "artifacts/template"
    },
    {
      "role": "solution",
      "path": "artifacts/solution"
    },
    {
      "role": "tests",
      "path": "artifacts/tests"
    }
  ],
  "diagnostics": [
    {
      "id": "artemis-events",
      "kind": "event_journal",
      "path": "artemis/events.jsonl",
      "media_type": "application/x-ndjson",
      "sha256": "469cc806ac692c52fc31a2c3988558c4e35bfc5cee195fbce70d3e2c7ac5496b",
      "size_bytes": 55343,
      "record_count": 199,
      "visibility": "restricted"
    },
    {
      "id": "artemis-terminal-status",
      "kind": "provenance",
      "path": "artemis/terminal-status.json",
      "media_type": "application/json",
      "sha256": "6a2551ac1dda9e9f76db21fab4720999709d3786a6796c7b6b13b2b4ec27dbd6",
      "size_bytes": 53074,
      "visibility": "restricted"
    },
    {
      "id": "artemis-generation-evidence",
      "kind": "provenance",
      "path": "artemis/generation-evidence.json",
      "media_type": "application/json",
      "sha256": "3659678665f19cf03780706a97ceaa650573dc5c069ab96bb059f7b32c7314bc",
      "size_bytes": 12686,
      "visibility": "restricted"
    },
    {
      "id": "artemis-opentelemetry-trace",
      "kind": "trace",
      "path": "telemetry/opentelemetry-trace.json",
      "media_type": "application/json",
      "sha256": "952d80d763b96fae8e9e51dd6ce15c9f884878f521cb37a254b19375253e0bf3",
      "size_bytes": 15135110,
      "visibility": "restricted"
    }
  ],
  "capture": {
    "completeness": "complete"
  },
  "message": "The exercise was generated and saved. Review the changes. Automated quality review found issues that require instructor review. 3 review notes were added for your attention.",
  "usage": {
    "input_tokens": 2910971,
    "output_tokens": 91217,
    "total_tokens": 3002188,
    "model_calls": 174,
    "tool_calls": 154
  },
  "execution": {
    "requested_seed": 287454645,
    "seed_status": "unsupported",
    "effective_parameters": {},
    "provider_request_ids": [
      "chatcmpl-a69397c838b00837",
      "chatcmpl-8f0fcacf7980cd3a",
      "chatcmpl-b4b634a03228d14d",
      "chatcmpl-a243cb9e3a5c7901",
      "chatcmpl-97acc4e3aff449cc",
      "chatcmpl-a7ac1476821c7035",
      "chatcmpl-ab306532abcfbf03",
      "chatcmpl-a0cedeeb5307001f",
      "chatcmpl-a6df006997685b64",
      "chatcmpl-9ab5f9a9394b1991",
      "chatcmpl-b6046326c64d2694",
      "chatcmpl-8b3f5905a6bde4b6",
      "chatcmpl-a5682ba3c2eca162",
      "chatcmpl-8fedd215243c0b96",
      "chatcmpl-929f7d1c1d489678",
      "chatcmpl-b46b43c3e81e16e2",
      "chatcmpl-b4228033cf63453b",
      "chatcmpl-8d5bb1039cb35e46",
      "chatcmpl-9bcf705d4fc8a726",
      "chatcmpl-b4e5044cca88f7e3",
      "chatcmpl-b0067adc8de31dee",
      "chatcmpl-98b4df7933e6cb97",
      "chatcmpl-b16c5cbfc5c19463",
      "chatcmpl-8ff1471d18b8d754",
      "chatcmpl-bc02500825ed93a4",
      "chatcmpl-9a81812fda136c8d",
      "chatcmpl-a05f148cf7174c5c",
      "chatcmpl-884b4c3977799df0",
      "chatcmpl-9b48e07684c47ecd",
      "chatcmpl-aec6cfedde381d48",
      "chatcmpl-87b7d4b1a5ac626c",
      "chatcmpl-98e9754a58bb480c",
      "chatcmpl-86206276060513e0",
      "chatcmpl-9e7e2b2584050e39",
      "chatcmpl-a4f45cb921b07b4b",
      "chatcmpl-90d903b3ca693baa",
      "chatcmpl-9086da9f8a27b694",
      "chatcmpl-b852797c0ed9e31f",
      "chatcmpl-a9c931297fe2ba68",
      "chatcmpl-879d19040a0eaf71",
      "chatcmpl-a536dea19cc2262c",
      "chatcmpl-baf50c0bfcf1ea42",
      "chatcmpl-9b1ecc972342fd7f",
      "chatcmpl-b4c6662fa7784b83",
      "chatcmpl-bf5325ad189297e4",
      "chatcmpl-9ba5ee35ecfdfd2b",
      "chatcmpl-a03e64b7587a792e",
      "chatcmpl-96fc6d456d38d0c8",
      "chatcmpl-9037a90a99e7bae9",
      "chatcmpl-8ea5509d365f0675",
      "chatcmpl-86d2b42d7a483145",
      "chatcmpl-a0b0c7b3075721cd",
      "chatcmpl-be74fbd775261570",
      "chatcmpl-92b13a72de64461b",
      "chatcmpl-987e6f2e9032c7d3",
      "chatcmpl-a06586b33429386f",
      "chatcmpl-ad8e9c719db7e214",
      "chatcmpl-bb3d9aef67d33a40",
      "chatcmpl-92072a2888d8fa9a",
      "chatcmpl-910434583fdc534d",
      "chatcmpl-880d5e9b2444be45",
      "chatcmpl-b3f1eda192572190",
      "chatcmpl-a609dcfdb965b996",
      "chatcmpl-85e6d816964c20c0",
      "chatcmpl-ab5c7c8be8b9b2e0",
      "chatcmpl-ab86f8cc4af88699",
      "chatcmpl-abd472c62debded8",
      "chatcmpl-af050561d27b478d",
      "chatcmpl-b55adfa68244fe98",
      "chatcmpl-b76128c1bce2b7cb",
      "chatcmpl-a19bec46e4ff7d05",
      "chatcmpl-83907e3a86cf598d",
      "chatcmpl-b73165cb928d3bbd",
      "chatcmpl-a65713f886fb55b6",
      "chatcmpl-b7b009ab0f064738",
      "chatcmpl-b424d297443a4481",
      "chatcmpl-aaeca3769edc16b4",
      "chatcmpl-accba4a46a86114f",
      "chatcmpl-aaf74cd4018c6332",
      "chatcmpl-bbaa6d1f6ff3a861",
      "chatcmpl-9c3caae27e3c1354",
      "chatcmpl-bdcbfe232d47d499",
      "chatcmpl-94a79f7ba375469f",
      "chatcmpl-8fe35a15bb026761",
      "chatcmpl-a75dd53f788b6ae6",
      "chatcmpl-8bc353874f0e303a",
      "chatcmpl-9c30ddec129615f1",
      "chatcmpl-ad23be39377989d0",
      "chatcmpl-884c2a78a343086e",
      "chatcmpl-8b27a53f48eaa702",
      "chatcmpl-a55015ab94e17811",
      "chatcmpl-84b15754b7e7d1db",
      "chatcmpl-9a595aee57dca1f8",
      "chatcmpl-90dd114df63f07a8",
      "chatcmpl-9d467d8f2af08b2e",
      "chatcmpl-b3a123399ae66ed6",
      "chatcmpl-a8df1c96a462474a",
      "chatcmpl-ae29ea9451a720fb",
      "chatcmpl-be740c76e5b1c706",
      "chatcmpl-9b3640c61a4ed391",
      "chatcmpl-8e96d848562378b2",
      "chatcmpl-baf22158499d17cf",
      "chatcmpl-956815e6395f1ee9",
      "chatcmpl-9d04456adf4584dc",
      "chatcmpl-a6848392f8d5e6c4",
      "chatcmpl-85289d983e393109",
      "chatcmpl-b078c7f3abe5d6ff",
      "chatcmpl-8f80ca0dc2877d19",
      "chatcmpl-bfb727cb0ecf3e7d",
      "chatcmpl-ad1808b5bfb621a4",
      "chatcmpl-8e23fc30c997dc2b",
      "chatcmpl-81621257944db76f",
      "chatcmpl-ba48759f0b6a93c8",
      "chatcmpl-a2e99d63eac7765f",
      "chatcmpl-832c737c4a455ea9",
      "chatcmpl-97ef7f85eab9b955",
      "chatcmpl-8b8aea8330d28bb9",
      "chatcmpl-90e7702da4e46b54",
      "chatcmpl-ae7c881b7fa71f8e",
      "chatcmpl-9ce319a1339767dc",
      "chatcmpl-ac77d5cda334f34e",
      "chatcmpl-b690e3022378c13d",
      "chatcmpl-ab247bb98ce7483e",
      "chatcmpl-93c5394d6d4399f0",
      "chatcmpl-9c66858d72a6d4cf",
      "chatcmpl-bc776e834f9f5915",
      "chatcmpl-b9c36cd6e4ce06fa",
      "chatcmpl-8ed7d513b48c168c",
      "chatcmpl-8dd03291a0a8adf5",
      "chatcmpl-a99f71de6d174a2c",
      "chatcmpl-8ffe2dfbbb83ea4d",
      "chatcmpl-891e4d5263ed36b7",
      "chatcmpl-96221cdab08906e7",
      "chatcmpl-a0495164d2eb2d91",
      "chatcmpl-bd71cd3cbc1fa4a0",
      "chatcmpl-b2ee184d6ab13e28",
      "chatcmpl-b729a9b7a2378290",
      "chatcmpl-b729627bb740a35e",
      "chatcmpl-a99e026d89d13f40",
      "chatcmpl-bfc0c9c21c179cb4",
      "chatcmpl-93d480954dfef3f6",
      "chatcmpl-895b710f37d7048a",
      "chatcmpl-b598023933ea0637",
      "chatcmpl-a8d9392c0d60e344",
      "chatcmpl-a2143e52fc0c8a06",
      "chatcmpl-bdb2747cce48c072",
      "chatcmpl-93793d8d0d990d51",
      "chatcmpl-8c06d7533ea346fa",
      "chatcmpl-bbb7d7a2b2ea24d9",
      "chatcmpl-9f5b4c763f18e9e5",
      "chatcmpl-9b567e0ca18672cb",
      "chatcmpl-acfd89a770067187",
      "chatcmpl-939ef65674fc2329",
      "chatcmpl-8f2cc940ab1e207b",
      "chatcmpl-a2d1192564239af9",
      "chatcmpl-a6540907829b4032",
      "chatcmpl-83ac20b022421978",
      "chatcmpl-ab5e06a3c063e2d8",
      "chatcmpl-9a5ea7ad71c78645",
      "chatcmpl-a7215df29daa9fe7",
      "chatcmpl-b939a1b29c5ef64a",
      "chatcmpl-a88fc389e8f6984a",
      "chatcmpl-a0d185310c68ae1b",
      "chatcmpl-bac38810158c503a",
      "chatcmpl-bc69f0b8a132300e",
      "chatcmpl-b2cd576d928aeba6",
      "chatcmpl-90948caa276d3c76",
      "chatcmpl-a03af77e045bd709",
      "chatcmpl-a02b4ddfc2bde089",
      "chatcmpl-96e67f27c79e39c4",
      "chatcmpl-9642a0cb9bead802",
      "chatcmpl-863041f9967eaebb",
      "chatcmpl-b95f9df782284627",
      "chatcmpl-b5512cca94a565a4"
    ],
    "provider_request_ids_complete": true
  },
  "extensions": {
    "artemis": {
      "exercise_id": 31,
      "job_id": "cf2b78ba-57a8-44da-a44a-5b0bbe6e49cb",
      "exact_exercise_version_id": 35,
      "saved_repository_commits": {
        "template": "ddd41630b232fab699e76af85465a831709b7f8f",
        "solution": "9524de86a0a91bd33511b5b16db4313270d3d4e9",
        "tests": "5119c90ae9f38c6faeb98d9aca6d9f4a5b8a4daa"
      },
      "evidence_path": "artemis/generation-evidence.json",
      "usage_accounting_complete": true,
      "models": [
        "openai/gpt-oss-120b"
      ],
      "completion_status": "NEEDS_REVIEW",
      "termination_reason": "TOKEN_BUDGET_EXHAUSTED",
      "cost_verified": true,
      "measurement": {
        "outcome": "captured"
      },
      "telemetry": {
        "provider": "opentelemetry",
        "trace_id": "19cf01e1553365d469e342d8086365a2",
        "span_count": 349,
        "model_span_count": 174
      }
    }
  }
}
