{
  "protocol_version": "2",
  "status": "failed",
  "artifacts": [],
  "diagnostics": [
    {
      "id": "artemis-events",
      "kind": "event_journal",
      "path": "artemis/events.jsonl",
      "media_type": "application/x-ndjson",
      "sha256": "2e248b87b5f13da2f206640e6c9327277a36232135ffd418327c5a89144a4530",
      "size_bytes": 2857,
      "record_count": 10,
      "visibility": "restricted"
    },
    {
      "id": "artemis-terminal-status",
      "kind": "provenance",
      "path": "artemis/terminal-status.json",
      "media_type": "application/json",
      "sha256": "f2106f3ef8ca7328628b8e3309f46921494e61132446ccb55cdf846141b208a2",
      "size_bytes": 2911,
      "visibility": "restricted"
    },
    {
      "id": "artemis-opentelemetry-trace",
      "kind": "trace",
      "path": "telemetry/opentelemetry-trace.json",
      "media_type": "application/json",
      "sha256": "aec4b9e4844b733210dec57149f775b51e074e55283639fe13788caa7636a830",
      "size_bytes": 274703,
      "visibility": "restricted"
    }
  ],
  "capture": {
    "completeness": "none",
    "reason": "The agent loop ended with an error."
  },
  "message": "The agent loop ended with an error.",
  "usage": {
    "input_tokens": 23602,
    "output_tokens": 23655,
    "total_tokens": 47257,
    "model_calls": 10,
    "tool_calls": 0
  },
  "execution": {
    "requested_seed": 1242311203,
    "seed_status": "unsupported",
    "effective_parameters": {},
    "provider_request_ids": [
      "chatcmpl-96310966489bc740",
      "chatcmpl-bf1d2f5b614532ac",
      "chatcmpl-a71a2bd42d953b14",
      "chatcmpl-adc96a83d4188d59",
      "chatcmpl-831df70cd58650b5",
      "chatcmpl-add30395febcb94d",
      "chatcmpl-b8f153282db7b9d1",
      "chatcmpl-894c805a2c9a2fcc",
      "chatcmpl-92f11e20967f7e9e",
      "chatcmpl-8dae05007a1cfb12"
    ],
    "provider_request_ids_complete": true
  },
  "extensions": {
    "artemis": {
      "failure_class": "generation",
      "exercise_id": 43,
      "job_id": "97b5f119-69ca-4c04-a84b-9ca93c8e6ed6",
      "usage_accounting_complete": true,
      "models": [
        "openai/gpt-oss-120b"
      ],
      "completion_status": "none",
      "termination_reason": "AGENT_ERROR",
      "cost_verified": true,
      "measurement": {
        "outcome": "captured"
      },
      "telemetry": {
        "provider": "opentelemetry",
        "trace_id": "81bb7b9932cc442e6c0afe58b19785dc",
        "span_count": 21,
        "model_span_count": 10
      }
    }
  }
}
