{
  "protocol_version": "2",
  "status": "succeeded",
  "artifacts": [
    {
      "role": "problem_statement",
      "path": "problem-statement.md",
      "media_type": "text/markdown"
    },
    {
      "role": "template",
      "path": "template"
    },
    {
      "role": "solution",
      "path": "solution"
    },
    {
      "role": "tests",
      "path": "tests"
    }
  ],
  "diagnostics": [
    {
      "id": "artemis-events",
      "kind": "event_journal",
      "path": "artemis/events.jsonl",
      "media_type": "application/x-ndjson",
      "sha256": "f0606800006a630a6e681f8172e88eb285f607bdd91b289a89399b88d44d7f75",
      "size_bytes": 54462,
      "record_count": 196,
      "visibility": "restricted"
    },
    {
      "id": "artemis-terminal-status",
      "kind": "provenance",
      "path": "artemis/terminal-status.json",
      "media_type": "application/json",
      "sha256": "95db9d2d254aa6cdb5b8921c4d69ccc618ee2a7ae3711f82b1f2d24d476bf3c5",
      "size_bytes": 50633,
      "visibility": "restricted"
    },
    {
      "id": "artemis-generation-evidence",
      "kind": "provenance",
      "path": "artemis/generation-evidence.json",
      "media_type": "application/json",
      "sha256": "1a4a5217a9b2fb65e36b36a5cdec34b14bbe6c6358b420b84851c4b906d9a199",
      "size_bytes": 11280,
      "visibility": "restricted"
    },
    {
      "id": "artemis-opentelemetry-trace",
      "kind": "trace",
      "path": "telemetry/opentelemetry-trace.json",
      "media_type": "application/json",
      "sha256": "11d34cd36992301edb4f59be67c7d4134f8c5218dc6574c097058fc6d5d75ff3",
      "size_bytes": 11355525,
      "visibility": "restricted"
    }
  ],
  "capture": {
    "completeness": "complete"
  },
  "message": "The exercise was generated and saved. Review the changes. Automated quality review found issues that require instructor review. 5 review notes were added for your attention.",
  "usage": {
    "input_tokens": 2140466,
    "output_tokens": 113279,
    "total_tokens": 2253745,
    "model_calls": 170,
    "tool_calls": 139
  },
  "execution": {
    "requested_seed": 502785305,
    "seed_status": "unsupported",
    "effective_parameters": {},
    "provider_request_ids": [
      "chatcmpl-8602bcb4cc1c7827",
      "chatcmpl-a0ce074bccf24d9a",
      "chatcmpl-ad5c3c6fb6fa23f6",
      "chatcmpl-a57946363541cce1",
      "chatcmpl-ba6ff59cdfd45641",
      "chatcmpl-988e342546f18cef",
      "chatcmpl-8899d827af0f6515",
      "chatcmpl-874c0887a6d7b117",
      "chatcmpl-8b86dc6bd5b74418",
      "chatcmpl-9508de19b3c854ff",
      "chatcmpl-946fb6d41b7c5d80",
      "chatcmpl-b103f494ca0b4b47",
      "chatcmpl-92247836d14e2c9d",
      "chatcmpl-967d78ed45871661",
      "chatcmpl-bce9c2e0800e5c58",
      "chatcmpl-8bf9ae18e419dd0a",
      "chatcmpl-8cd55ad028a03195",
      "chatcmpl-96b941914c4c5a89",
      "chatcmpl-8310736e1d873f77",
      "chatcmpl-9d34629e48e398a6",
      "chatcmpl-b679e6e9df248901",
      "chatcmpl-802c9b6569f120e3",
      "chatcmpl-94d0814fcca49024",
      "chatcmpl-ab90e7ca07694512",
      "chatcmpl-bbb5b0471f70cdb0",
      "chatcmpl-8127aedeb24b9ca3",
      "chatcmpl-b7c4cc88c44e65a8",
      "chatcmpl-8a1682a678187bbd",
      "chatcmpl-86b32dde67d95997",
      "chatcmpl-b53d51cdc67ded8c",
      "chatcmpl-a1fbe074148a25ee",
      "chatcmpl-be0867c2d3439a37",
      "chatcmpl-82411e19c44fc9f3",
      "chatcmpl-85220affc1fb91b3",
      "chatcmpl-874bf0c8b06d0150",
      "chatcmpl-be4b4f37067aa059",
      "chatcmpl-b23cb054919c04ad",
      "chatcmpl-b9d476ed87ce46e4",
      "chatcmpl-99be238762b44b2b",
      "chatcmpl-9e9e234584d4e863",
      "chatcmpl-896f699d6fc29346",
      "chatcmpl-9fab83139b56f050",
      "chatcmpl-b3b4a2891404bd81",
      "chatcmpl-b193777f59e5081e",
      "chatcmpl-963b2610eb3c3c63",
      "chatcmpl-9ddb21c00a24a6ea",
      "chatcmpl-b839ea0f622df042",
      "chatcmpl-b02a5111fae089ba",
      "chatcmpl-a9c4fa72fd64f381",
      "chatcmpl-a762901f97d172bf",
      "chatcmpl-8b865837616850c9",
      "chatcmpl-8b543bb701de41c4",
      "chatcmpl-b921f3bcf4662371",
      "chatcmpl-ad0c11b438436a70",
      "chatcmpl-a3e6d2d56dcb2322",
      "chatcmpl-8352953aa8e25b1e",
      "chatcmpl-96f601d9c3d749b2",
      "chatcmpl-82bbf980bcb7eea1",
      "chatcmpl-8898b399c4f8dbd3",
      "chatcmpl-aeba24159da24a70",
      "chatcmpl-85a3c851fe6e76b9",
      "chatcmpl-8895eae92a0ef465",
      "chatcmpl-95e0d45bfbf579b1",
      "chatcmpl-a4b38bedb1c1bbfb",
      "chatcmpl-8c44cb085093f15a",
      "chatcmpl-b42016f935de97af",
      "chatcmpl-8e061fb36c495927",
      "chatcmpl-b35b8c828ed801de",
      "chatcmpl-a4939625d6fd3a1d",
      "chatcmpl-968933391c801d86",
      "chatcmpl-9e24624da0c9d1a3",
      "chatcmpl-84180d5ea6963343",
      "chatcmpl-89d197c727fc19d0",
      "chatcmpl-8fc0ede4d0f17cd3",
      "chatcmpl-b1b08d73a652026b",
      "chatcmpl-904f1156f8a2519f",
      "chatcmpl-9e09a96ccf64a5a7",
      "chatcmpl-b43e7d0fda334e79",
      "chatcmpl-aa2aaf19e4ce55c8",
      "chatcmpl-aa8d40d6c088784a",
      "chatcmpl-8fd005ae5c8b3b58",
      "chatcmpl-ae3531133e5c3a64",
      "chatcmpl-8f7c24d461e3efda",
      "chatcmpl-ac24a7eeb8d2e587",
      "chatcmpl-ad3573b82c1ab134",
      "chatcmpl-a4575b44e44a7b11",
      "chatcmpl-81ef11c1db50b813",
      "chatcmpl-a5d05036bd460206",
      "chatcmpl-865e36f47f51b490",
      "chatcmpl-86e4a85087ea3e81",
      "chatcmpl-85bee2541bbb6a53",
      "chatcmpl-b7401e026cc10a3d",
      "chatcmpl-90ee58e19b3ed528",
      "chatcmpl-8b01262086f305cc",
      "chatcmpl-b17bb257aa5fcb4d",
      "chatcmpl-8994b80189d7c9b5",
      "chatcmpl-a2c0d19c088eef49",
      "chatcmpl-bcf542ab49c0953b",
      "chatcmpl-be85de16c5a21b75",
      "chatcmpl-b515e64d5e168cc9",
      "chatcmpl-86369514760c49f0",
      "chatcmpl-b5ead6ed9eb822fb",
      "chatcmpl-867ff2f21e45c904",
      "chatcmpl-b2ac867f1e0da17e",
      "chatcmpl-9305494d89711c82",
      "chatcmpl-907b5ff446d4ada6",
      "chatcmpl-a641aafba9aa6bfb",
      "chatcmpl-a90c44ccc35b0a1b",
      "chatcmpl-8716ae9ae3ce2fb1",
      "chatcmpl-ab7ee4a7eca2e267",
      "chatcmpl-a28c97e9808acab2",
      "chatcmpl-8c2d901e101b3171",
      "chatcmpl-8be70cd40fcd0254",
      "chatcmpl-a594c1777f7e67e0",
      "chatcmpl-87c7e7784277e702",
      "chatcmpl-8316e171fa4733c3",
      "chatcmpl-95a75c157035e630",
      "chatcmpl-8cb5674df4891945",
      "chatcmpl-b98806f42ff9bfad",
      "chatcmpl-bd0d07da7828ebda",
      "chatcmpl-a1fe34fcb2dd88cd",
      "chatcmpl-abcc205de5327137",
      "chatcmpl-bff5881ef62a1723",
      "chatcmpl-9c808c289ac0b9c4",
      "chatcmpl-979800381d6e81a9",
      "chatcmpl-bc373a4a12ad3a9a",
      "chatcmpl-8e1eb826c108bbba",
      "chatcmpl-acd0ec210797a7d2",
      "chatcmpl-afc7d790ef00597a",
      "chatcmpl-aa8d07b0b03b7379",
      "chatcmpl-a1beac3d640ab5a7",
      "chatcmpl-91461d9831c8eb7a",
      "chatcmpl-be48d379452e0cfb",
      "chatcmpl-b4afdc4f96ef6e6c",
      "chatcmpl-912ae98f182eb707",
      "chatcmpl-8caa26220e88e739",
      "chatcmpl-acd42f1527c2c95d",
      "chatcmpl-b76a13d84043cbfe",
      "chatcmpl-a373f5bb1bdcc40c",
      "chatcmpl-9bbb3331a371cf5b",
      "chatcmpl-bca7fcbe0b5361ae",
      "chatcmpl-b7238afcdfc1a2c3",
      "chatcmpl-b694930ed187b134",
      "chatcmpl-a18c88b78ba53141",
      "chatcmpl-be9a745685555d45",
      "chatcmpl-9a41cbe0aa743910",
      "chatcmpl-b36c804b4bcd0ae3",
      "chatcmpl-abdefb168b50559e",
      "chatcmpl-ba1bc2682667c7d0",
      "chatcmpl-99d705d13b623da9",
      "chatcmpl-9bfa471c72ee5864",
      "chatcmpl-a6256b6e1a02d8a7",
      "chatcmpl-b2649ee4c7d56fb0",
      "chatcmpl-842014cbe97d7c54",
      "chatcmpl-88a1e79dd6b783db",
      "chatcmpl-84de9db8fde608ce",
      "chatcmpl-b2283921ddf05087",
      "chatcmpl-b37ec5309670abf1",
      "chatcmpl-bb441a31695e4bfe",
      "chatcmpl-bf9ca8bf794c52c2",
      "chatcmpl-bfa08cc83d2f2361",
      "chatcmpl-962d2d100defe858",
      "chatcmpl-b9efd42963b4cbeb",
      "chatcmpl-a150cecf0d16d6ce",
      "chatcmpl-b06a1c402df2ddab",
      "chatcmpl-bf58c326123e2295",
      "chatcmpl-a1eec8544b18a30b",
      "chatcmpl-814b1fc232c2b5ca",
      "chatcmpl-a10d09da4fa19149",
      "chatcmpl-9745f65ae26165b1"
    ],
    "provider_request_ids_complete": true
  },
  "extensions": {
    "artemis": {
      "exercise_id": 36,
      "job_id": "4031ba59-c386-478c-8fd4-faac9326090e",
      "exact_exercise_version_id": 44,
      "saved_repository_commits": {
        "template": "afc068e61f57906c27449ffcc370595ab8ed359f",
        "solution": "f13b3e5ef598bc60c4fa63aeb445c47cbe0fe0e9",
        "tests": "ce8557c16a9e4c597d6519f7c4201884ece1192e"
      },
      "evidence_path": "artemis/generation-evidence.json",
      "usage_accounting_complete": true,
      "models": [
        "openai/gpt-oss-120b"
      ],
      "completion_status": "NEEDS_REVIEW",
      "termination_reason": "NO_SCHEDULABLE_SURFACE",
      "cost_verified": true,
      "measurement": {
        "outcome": "captured"
      },
      "telemetry": {
        "provider": "opentelemetry",
        "trace_id": "14ab5cd9f952a94d42048de0cdcf5cc8",
        "span_count": 341,
        "model_span_count": 170
      }
    }
  }
}
